{
  "audit_ref": "66ea24bc-29b3-405b-825e-5793f593a4d3",
  "availability_state": "healthy",
  "created_at": "2026-06-23T08:34:25Z",
  "derived_metadata": {
    "confidence_scaled": 91,
    "motion_detected": true
  },
  "observation_id": "892fded0-5332-4fa3-a912-65edb338e029",
  "permission_state": "granted",
  "plain_language_summary": "Echo Guardian received a motion safety signal for living_room and stored only derived metadata.",
  "private_space": false,
  "quality": "good",
  "raw_sensor_retained": false,
  "schema_version": "0.2",
  "sensor_id": "core_motion.activity",
  "signal_type": "motion",
  "space_id": "living_room"
}
